{
  "company_id": "scalar-labs.com",
  "organization_id": "9ca84f95-2e84-4707-8206-b93c9e78d7b7",
  "category_of_benefit": "sed anim",
  "benefit_name": "dolore magnaxxx",
  "description": "in enim qui dolor",
  "provider": "Duis in",
  "time_of_provision": "reprehenderit nisi nostrud eiusmod ullamco",
  "benefit_id": "benefit-9ca84f95-2e84-4707-8206-b93c9e78d7b7-2"
}
