{
  "company_id": "scalar-labs.com",
  "organization_id": "org1",
  "category_of_benefit": "sed anim",
  "benefit_name": "dolore magna",
  "description": "in enim qui dolor",
  "provider": "Duis in",
  "time_of_provision": "reprehenderit nisi nostrud eiusmod ullamco",
  "benefit_id": "benefit-org1-1"
}
